{
  "$schema": "./schema/p5-manifest.schema.json",
  "schemaVersion": "1.0.0",
  "name": "pi-benchmark-p5-luna",
  "reference": "dd00b33f039b4c6d291b1c241aaae9eb66ba4b85",
  "seriesId": "P5-LUNA-HARNESS",
  "mode": "core-parity",
  "privateEvaluator": "PI_BENCHMARK_PRIVATE_ROOT",
  "harnesses": {
    "pi": {
      "provider": "openai-codex",
      "model": "gpt-5.6-luna",
      "thinking": "high",
      "roles": {
        "main": { "model": "openai-codex/gpt-5.6-luna", "thinking": "high" },
        "investigator": {
          "model": "openai-codex/gpt-5.6-luna",
          "thinking": "high"
        },
        "debugger": {
          "model": "openai-codex/gpt-5.6-luna",
          "thinking": "high"
        },
        "verifier": { "enabled": false }
      }
    },
    "codex": {
      "cliVersion": "0.149.1",
      "model": "gpt-5.6-luna",
      "reasoningEffort": "high",
      "sandbox": "workspace-write",
      "approvalPolicy": "never",
      "networkAccess": false
    }
  },
  "runs": [
    {
      "id": "p5-smoke-05-pi",
      "task": "05-refactor-no-behavior-change",
      "harness": "pi",
      "stackMode": "core-parity"
    },
    {
      "id": "p5-smoke-05-codex",
      "task": "05-refactor-no-behavior-change",
      "harness": "codex",
      "stackMode": "core-parity"
    },

    {
      "id": "p5-pilot-05-pi-r1",
      "task": "05-refactor-no-behavior-change",
      "harness": "pi",
      "stackMode": "core-parity"
    },
    {
      "id": "p5-pilot-05-pi-r2",
      "task": "05-refactor-no-behavior-change",
      "harness": "pi",
      "stackMode": "core-parity"
    },
    {
      "id": "p5-pilot-05-pi-r3",
      "task": "05-refactor-no-behavior-change",
      "harness": "pi",
      "stackMode": "core-parity"
    },
    {
      "id": "p5-pilot-05-codex-r1",
      "task": "05-refactor-no-behavior-change",
      "harness": "codex",
      "stackMode": "core-parity"
    },
    {
      "id": "p5-pilot-05-codex-r2",
      "task": "05-refactor-no-behavior-change",
      "harness": "codex",
      "stackMode": "core-parity"
    },
    {
      "id": "p5-pilot-05-codex-r3",
      "task": "05-refactor-no-behavior-change",
      "harness": "codex",
      "stackMode": "core-parity"
    },

    {
      "id": "p5-pilot-02-pi-r1",
      "task": "02-local-bug",
      "harness": "pi",
      "stackMode": "core-parity"
    },
    {
      "id": "p5-pilot-02-pi-r2",
      "task": "02-local-bug",
      "harness": "pi",
      "stackMode": "core-parity"
    },
    {
      "id": "p5-pilot-02-pi-r3",
      "task": "02-local-bug",
      "harness": "pi",
      "stackMode": "core-parity"
    },
    {
      "id": "p5-pilot-02-codex-r1",
      "task": "02-local-bug",
      "harness": "codex",
      "stackMode": "core-parity"
    },
    {
      "id": "p5-pilot-02-codex-r2",
      "task": "02-local-bug",
      "harness": "codex",
      "stackMode": "core-parity"
    },
    {
      "id": "p5-pilot-02-codex-r3",
      "task": "02-local-bug",
      "harness": "codex",
      "stackMode": "core-parity"
    },

    {
      "id": "p5-pilot-08-pi-r1",
      "task": "08-long-session-compaction",
      "harness": "pi",
      "stackMode": "core-parity"
    },
    {
      "id": "p5-pilot-08-pi-r2",
      "task": "08-long-session-compaction",
      "harness": "pi",
      "stackMode": "core-parity"
    },
    {
      "id": "p5-pilot-08-pi-r3",
      "task": "08-long-session-compaction",
      "harness": "pi",
      "stackMode": "core-parity"
    },
    {
      "id": "p5-pilot-08-codex-r1",
      "task": "08-long-session-compaction",
      "harness": "codex",
      "stackMode": "core-parity"
    },
    {
      "id": "p5-pilot-08-codex-r2",
      "task": "08-long-session-compaction",
      "harness": "codex",
      "stackMode": "core-parity"
    },
    {
      "id": "p5-pilot-08-codex-r3",
      "task": "08-long-session-compaction",
      "harness": "codex",
      "stackMode": "core-parity"
    }
  ]
}
